{
  "schema_version": 2,
  "mode": "single",
  "mode_reason": "{{按模块拆分、跨域依赖和团队并行方式说明模式选择依据}}",
  "total": {
    "id": "total",
    "path": "03-详细设计.md",
    "template_id": "详细设计-模板",
    "template_version": "1.3.0",
    "acceptance_ids": [],
    "object_refs": {
      "features": [],
      "glossary": [],
      "tables": [],
      "apis": [],
      "permissions": [],
      "rules": [],
      "flows": [],
      "diagrams": [],
      "pages": [],
      "dependencies": [],
      "reuse_decisions": [],
      "quality_decisions": [],
      "domain_objects": []
    }
  },
  "subdocuments": [],
  "shared_object_refs": []
}
